"Authors","Author full names","Author(s) ID","Title","Year","Source title","Cited by","DOI","Link","Abstract","Index Keywords","Publisher","Document Type","Publication Stage","Source","EID"
"Ta C.N.; Zucker J.E.; Chiu P.-H.; Fang Y.; Natarajan K.; Weng C.","Ta, Casey N. (57204783049); Zucker, Jason E. (57529188300); Chiu, Po-Hsiang (58070275400); Fang, Yilu (57224206499); Natarajan, Karthik (55014092900); Weng, Chunhua (58070275500)","57204783049; 57529188300; 58070275400; 57224206499; 55014092900; 58070275500","Clinical and temporal characterization of COVID-19 subgroups using patient vector embeddings of electronic health records","2023","Journal of the American Medical Informatics Association : JAMIA","0","10.1093/jamia/ocac208","https://www.scopus.com/inward/record.uri?eid=2-s2.0-85146484472&doi=10.1093%2fjamia%2focac208&partnerID=40&md5=177a40d3fe69d0397786d9f5cca30828","OBJECTIVE: To identify and characterize clinical subgroups of hospitalized Coronavirus Disease 2019 (COVID-19) patients. MATERIALS AND METHODS: Electronic health records of hospitalized COVID-19 patients at NewYork-Presbyterian/Columbia University Irving Medical Center were temporally sequenced and transformed into patient vector representations using Paragraph Vector models. K-means clustering was performed to identify subgroups. RESULTS: A diverse cohort of 11 313 patients with COVID-19 and hospitalizations between March 2, 2020 and December 1, 2021 were identified; median [IQR] age: 61.2 [40.3-74.3]; 51.5% female. Twenty subgroups of hospitalized COVID-19 patients, labeled by increasing severity, were characterized by their demographics, conditions, outcomes, and severity (mild-moderate/severe/critical). Subgroup temporal patterns were characterized by the durations in each subgroup, transitions between subgroups, and the complete paths throughout the course of hospitalization. DISCUSSION: Several subgroups had mild-moderate severe acute respiratory syndrome coronavirus 2 (SARS-CoV-2) infections but were hospitalized for underlying conditions (pregnancy, cardiovascular disease [CVD], etc.). Subgroup 7 included solid organ transplant recipients who mostly developed mild-moderate or severe disease. Subgroup 9 had a history of type-2 diabetes, kidney and CVD, and suffered the highest rates of heart failure (45.2%) and end-stage renal disease (80.6%). Subgroup 13 was the oldest (median: 82.7 years) and had mixed severity but high mortality (33.3%). Subgroup 17 had critical disease and the highest mortality (64.6%), with age (median: 68.1 years) being the only notable risk factor. Subgroups 18-20 had critical disease with high complication rates and long hospitalizations (median: 40+ days). All subgroups are detailed in the full text. A chord diagram depicts the most common transitions, and paths with the highest prevalence, longest hospitalizations, lowest and highest mortalities are presented. Understanding these subgroups and their pathways may aid clinicians in their decisions for better management and earlier intervention for patients. © The Author(s) 2022. Published by Oxford University Press on behalf of the American Medical Informatics Association. All rights reserved. For permissions, please email: journals.permissions@oup.com.","Aged; Cardiovascular Diseases; COVID-19; Electronic Health Records; Female; Hospitalization; Humans; Male; Middle Aged; SARS-CoV-2; aged; cardiovascular disease; electronic health record; female; hospitalization; human; male; middle aged","NLM (Medline)","Article","Final","Scopus","2-s2.0-85146484472"
"Kim C.; You S.C.; Reps J.M.; Cheong J.Y.; Park R.W.","Kim, Chungsoo (57219296911); You, Seng Chan (57200255244); Reps, Jenna M. (43061445600); Cheong, Jae Youn (7004933299); Park, Rae Woong (9249349100)","57219296911; 57200255244; 43061445600; 7004933299; 9249349100","Machine-learning model to predict the cause of death using a stacking ensemble method for observational data","2021","Journal of the American Medical Informatics Association : JAMIA","13","10.1093/jamia/ocaa277","https://www.scopus.com/inward/record.uri?eid=2-s2.0-85108303068&doi=10.1093%2fjamia%2focaa277&partnerID=40&md5=b627928f34fbdac5d71964ee0f86ad01","OBJECTIVE: Cause of death is used as an important outcome of clinical research; however, access to cause-of-death data is limited. This study aimed to develop and validate a machine-learning model that predicts the cause of death from the patient's last medical checkup. MATERIALS AND METHODS: To classify the mortality status and each individual cause of death, we used a stacking ensemble method. The prediction outcomes were all-cause mortality, 8 leading causes of death in South Korea, and other causes. The clinical data of study populations were extracted from the national claims (n = 174 747) and electronic health records (n = 729 065) and were used for model development and external validation. Moreover, we imputed the cause of death from the data of 3 US claims databases (n = 994 518, 995 372, and 407 604, respectively). All databases were formatted to the Observational Medical Outcomes Partnership Common Data Model. RESULTS: The generalized area under the receiver operating characteristic curve (AUROC) of the model predicting the cause of death within 60 days was 0.9511. Moreover, the AUROC of the external validation was 0.8887. Among the causes of death imputed in the Medicare Supplemental database, 11.32% of deaths were due to malignant neoplastic disease. DISCUSSION: This study showed the potential of machine-learning models as a new alternative to address the lack of access to cause-of-death data. All processes were disclosed to maintain transparency, and the model was easily applicable to other institutions. CONCLUSION: A machine-learning model with competent performance was developed to predict cause of death. © The Author(s) 2020. Published by Oxford University Press on behalf of the American Medical Informatics Association. All rights reserved. For permissions, please email: journals.permissions@oup.com.","Area Under Curve; Cause of Death; Databases, Factual; Decision Support Systems, Clinical; Humans; Machine Learning; Medical Records Systems, Computerized; Models, Statistical; Observation; Prognosis; Republic of Korea; ROC Curve; United States; area under the curve; cause of death; clinical decision support system; electronic medical record system; epidemiology; factual database; human; machine learning; observation; prognosis; receiver operating characteristic; South Korea; statistical model; United States","NLM (Medline)","Article","Final","Scopus","2-s2.0-85108303068"
"Liaw S.-T.; Godinho M.A.","Liaw, Siaw-Teng (57222409062); Godinho, Myron Anthony (57188631069)","57222409062; 57188631069","Digital health and capability maturity models-a critical thematic review and conceptual synthesis of the literature","2023","Journal of the American Medical Informatics Association : JAMIA","1","10.1093/jamia/ocac228","https://www.scopus.com/inward/record.uri?eid=2-s2.0-85146484272&doi=10.1093%2fjamia%2focac228&partnerID=40&md5=8b85ea65b15c0ccee86d657d22692824","OBJECTIVE: A literature review of capability maturity models (MMs) to inform the conceptualization, development, implementation, evaluation, and mainstreaming of MMs in digital health (DH). METHODS: Electronic databases were searched using ""digital health,"" ""maturity models,"" and related terms based on the Digital Health Profile and Maturity Assessment Toolkit Maturity Model (DHPMAT-MM). Covidence was used to screen, identify, capture, and achieve consensus on data extracted by the authors. Descriptive statistics were generated. A thematic analysis and conceptual synthesis were conducted. FINDINGS: Diverse domain-specific MMs and model development, implementation, and evaluation methods were found. The spread and pattern of different MMs verified the essential DH foundations and five maturity stages of the DHPMAT-MM. An unanticipated finding was the existence of a new category of community-facing MMs. Common characteristics included:1. A dynamic lifecycle approach to digital capability maturity, which is:a. responsive to environmental changes and may improve or worsen over time;b. accumulative, incorporating the attributes of the preceding stage; andc. sequential, where no maturity stage must be skipped.2. Sociotechnical quality improvement of the DH ecosystem and MM, which includes:a. investing in the organization's human, hardware, and software resources andb. a need to engage and improve the DH competencies of citizens. CONCLUSIONS: The diversity in MMs and variability in methods and content can create cognitive dissonance. A metamodel like the DHPMAT-MM can logically unify the many domain-specific MMs and guide the overall implementation and evaluation of DH ecosystems and MMs over the maturity lifecycle. © The Author(s) 2022. Published by Oxford University Press on behalf of the American Medical Informatics Association. All rights reserved. For permissions, please email: journals.permissions@oup.com.","Computers; Concept Formation; Ecosystem; Humans; Information Systems; Software; computer; concept formation; ecosystem; human; information system; software","NLM (Medline)","Review","Final","Scopus","2-s2.0-85146484272"
"Kang T.; Sun Y.; Kim J.H.; Ta C.; Perotte A.; Schiffer K.; Wu M.; Zhao Y.; Moustafa-Fahmy N.; Peng Y.; Weng C.","Kang, Tian (57158373200); Sun, Yingcheng (57221122040); Kim, Jae Hyun (57221252587); Ta, Casey (57204783049); Perotte, Adler (17233935400); Schiffer, Kayla (58264402400); Wu, Mutong (58264216100); Zhao, Yang (58264765300); Moustafa-Fahmy, Nour (58264402500); Peng, Yifan (58193369500); Weng, Chunhua (8979750700)","57158373200; 57221122040; 57221252587; 57204783049; 17233935400; 58264402400; 58264216100; 58264765300; 58264402500; 58193369500; 8979750700","EvidenceMap: a three-level knowledge representation for medical evidence computation and comprehension","2023","Journal of the American Medical Informatics Association : JAMIA","0","10.1093/jamia/ocad036","https://www.scopus.com/inward/record.uri?eid=2-s2.0-85159755686&doi=10.1093%2fjamia%2focad036&partnerID=40&md5=3b779beecd9d1993e5d3988d3a6ce9f1","OBJECTIVE: To develop a computable representation for medical evidence and to contribute a gold standard dataset of annotated randomized controlled trial (RCT) abstracts, along with a natural language processing (NLP) pipeline for transforming free-text RCT evidence in PubMed into the structured representation. MATERIALS AND METHODS: Our representation, EvidenceMap, consists of 3 levels of abstraction: Medical Evidence Entity, Proposition and Map, to represent the hierarchical structure of medical evidence composition. Randomly selected RCT abstracts were annotated following EvidenceMap based on the consensus of 2 independent annotators to train an NLP pipeline. Via a user study, we measured how the EvidenceMap improved evidence comprehension and analyzed its representative capacity by comparing the evidence annotation with EvidenceMap representation and without following any specific guidelines. RESULTS: Two corpora including 229 disease-agnostic and 80 COVID-19 RCT abstracts were annotated, yielding 12 725 entities and 1602 propositions. EvidenceMap saves users 51.9% of the time compared to reading raw-text abstracts. Most evidence elements identified during the freeform annotation were successfully represented by EvidenceMap, and users gave the enrollment, study design, and study Results sections mean 5-scale Likert ratings of 4.85, 4.70, and 4.20, respectively. The end-to-end evaluations of the pipeline show that the evidence proposition formulation achieves F1 scores of 0.84 and 0.86 in the adjusted random index score. CONCLUSIONS: EvidenceMap extends the participant, intervention, comparator, and outcome framework into 3 levels of abstraction for transforming free-text evidence from the clinical literature into a computable structure. It can be used as an interoperable format for better evidence retrieval and synthesis and an interpretable representation to efficiently comprehend RCT findings. © The Author(s) 2023. Published by Oxford University Press on behalf of the American Medical Informatics Association. All rights reserved. For permissions, please email: journals.permissions@oup.com.","Comprehension; COVID-19; Humans; Natural Language Processing; PubMed; comprehension; controlled study; coronavirus disease 2019; human; Medline; natural language processing; randomized controlled trial","NLM (Medline)","Article","Final","Scopus","2-s2.0-85159755686"
"Barrison P.D.; Flynn A.; Richesson R.; Conte M.; Landis-Lewis Z.; Boisvert P.; Friedman C.P.","Barrison, Philip D. (57204480181); Flynn, Allen (8637795600); Richesson, Rachel (14619793200); Conte, Marisa (58264640000); Landis-Lewis, Zach (13006593400); Boisvert, Peter (57194134781); Friedman, Charles P. (57203175245)","57204480181; 8637795600; 14619793200; 58264640000; 13006593400; 57194134781; 57203175245","Knowledge infrastructure: a priority to accelerate workflow automation in health care","2023","Journal of the American Medical Informatics Association : JAMIA","0","10.1093/jamia/ocad026","https://www.scopus.com/inward/record.uri?eid=2-s2.0-85159764829&doi=10.1093%2fjamia%2focad026&partnerID=40&md5=12f5a8e3f6846f426894eff13ec2c937","[No abstract available]","Automation; Delivery of Health Care; Health Facilities; Workflow; automation; health care delivery; health care facility; workflow","NLM (Medline)","Article","Final","Scopus","2-s2.0-85159764829"
"Hanauer D.A.; Zheng K.","Hanauer, David A. (8285567600); Zheng, Kai (35301387000)","8285567600; 35301387000","Paper versus EHR: simplistic comparisons may not capture current reality","2015","Journal of the American Medical Informatics Association : JAMIA","1","10.1093/jamia/ocu036","https://www.scopus.com/inward/record.uri?eid=2-s2.0-84937212373&doi=10.1093%2fjamia%2focu036&partnerID=40&md5=d03c68864fe9eb9051d693b97cc87ffe","[No abstract available]","Communication; Electronic Health Records; Humans; Internship and Residency; Physician-Patient Relations; doctor patient relation; electronic medical record; human; interpersonal communication; medical education","","Letter","Final","Scopus","2-s2.0-84937212373"
"Bakken S.","Bakken, Suzanne (7005058463)","7005058463","Advancing phenotyping through informatics innovation","2023","Journal of the American Medical Informatics Association : JAMIA","0","10.1093/jamia/ocac247","https://www.scopus.com/inward/record.uri?eid=2-s2.0-85146405607&doi=10.1093%2fjamia%2focac247&partnerID=40&md5=7fbd4affe9aa49627bac1630c80e0dab","[No abstract available]","Diffusion of Innovation; Medical Informatics; mass communication; medical informatics","NLM (Medline)","Article","Final","Scopus","2-s2.0-85146405607"
"Xia W.; Liu Y.; Wan Z.; Vorobeychik Y.; Kantacioglu M.; Nyemba S.; Clayton E.W.; Malin B.A.","Xia, Weiyi (55620595300); Liu, Yongtai (57200280006); Wan, Zhiyu (56581176600); Vorobeychik, Yevgeniy (8913948800); Kantacioglu, Murat (57222564559); Nyemba, Steve (36969303400); Clayton, Ellen Wright (7102432130); Malin, Bradley A. (6602093073)","55620595300; 57200280006; 56581176600; 8913948800; 57222564559; 36969303400; 7102432130; 6602093073","Enabling realistic health data re-identification risk assessment through adversarial modeling","2021","Journal of the American Medical Informatics Association : JAMIA","5","10.1093/jamia/ocaa327","https://www.scopus.com/inward/record.uri?eid=2-s2.0-85103228718&doi=10.1093%2fjamia%2focaa327&partnerID=40&md5=0244d4b1ffaf949b7c1cf10c8e3c60f4","OBJECTIVE: Re-identification risk methods for biomedical data often assume a worst case, in which attackers know all identifiable features (eg, age and race) about a subject. Yet, worst-case adversarial modeling can overestimate risk and induce heavy editing of shared data. The objective of this study is to introduce a framework for assessing the risk considering the attacker's resources and capabilities. MATERIALS AND METHODS: We integrate 3 established risk measures (ie, prosecutor, journalist, and marketer risks) and compute re-identification probabilities for data subjects. This probability is dependent on an attacker's capabilities (eg, ability to obtain external identified resources) and the subject's decision on whether to reveal their participation in a dataset. We illustrate the framework through case studies using data from over 1 000 000 patients from Vanderbilt University Medical Center and show how re-identification risk changes when attackers are pragmatic and use 2 known resources for attack: (1) voter registration lists and (2) social media posts. RESULTS: Our framework illustrates that the risk is substantially smaller in the pragmatic scenarios than in the worst case. Our experiments yield a median worst-case risk of 0.987 (where 0 is least risky and 1 is most risky); however, the median reduction in risk was 90.1% in the voter registration scenario and 100% in the social media posts scenario. Notably, these observations hold true for a wide range of adversarial capabilities. CONCLUSIONS: This research illustrates that re-identification risk is situationally dependent and that appropriate adversarial modeling may permit biomedical data sharing on a wider scale than is currently the case. © The Author(s) 2021. Published by Oxford University Press on behalf of the American Medical Informatics Association. All rights reserved. For permissions, please email: journals.permissions@oup.com.","Computer Security; Confidentiality; Data Anonymization; Humans; Probability; Risk; Risk Assessment; anonymization; computer security; confidentiality; human; probability; risk; risk assessment","NLM (Medline)","Article","Final","Scopus","2-s2.0-85103228718"
"Everson J.; Healy D.; Patel V.","Everson, Jordan (56062610500); Healy, Daniel (58264572200); Patel, Vaishali (22980633300)","56062610500; 58264572200; 22980633300","Experiences with information blocking in the United States: a national survey of hospitals","2023","Journal of the American Medical Informatics Association : JAMIA","0","10.1093/jamia/ocad060","https://www.scopus.com/inward/record.uri?eid=2-s2.0-85159755405&doi=10.1093%2fjamia%2focad060&partnerID=40&md5=05a12bd90d40e9c3a8c191c42414053b","OBJECTIVE: The 21st Century Cures Act Final Rule's information blocking provisions, which prohibited practices likely to interfere with, prevent, or materially discourage access, exchange, or use of electronic health information (EHI), began to apply to a limited set of data elements in April 2021 and expanded to all EHI in October 2022. We sought to describe hospital leaders' perceptions of the prevalence of practices that may constitute information blocking, by actor and hospital characteristics, following the rule's applicability date. MATERIALS AND METHODS: Cross-sectional analysis of a national survey of hospitals fielded in 2021. The analytic sample included 2092 nonfederal acute care hospitals in the United States. We present descriptive statistics on the perception of the prevalence of information blocking and results of multivariate regression models examining the association between hospital, health information technology (IT) developer and market characteristics and the perception of information blocking. RESULTS: Overall, 42% of hospitals reported observing some behavior they perceived to be information blocking. Thirty-six percent of responding hospitals perceived that healthcare providers either sometimes or often engaged in practices that may constitute information blocking, while 17% and 19% perceived that health IT developers (such as EHR developers) and State, regional and/or local health information exchanges did the same, respectively. Prevalence varied by health IT developer market share, hospital for-profit status, and health system market share. CONCLUSIONS AND RELEVANCE: These results support the value of efforts to further reduce friction in the exchange of EHI and support the need for continued observation to provide a sense of the prevalence of information blocking practices and for education and awareness of information blocking regulations. Published by Oxford University Press on behalf of the American Medical Informatics Association 2023.","Cross-Sectional Studies; Electronic Health Records; Health Information Exchange; Hospitals; Medical Informatics; United States; cross-sectional study; electronic health record; hospital; medical informatics; medical information system; United States","NLM (Medline)","Article","Final","Scopus","2-s2.0-85159755405"
"Alexander G.L.; Powell K.R.; Deroche C.B.","Alexander, Gregory L. (12772574600); Powell, Kimberly R. (56692244300); Deroche, Chelsea B. (55681824100)","12772574600; 56692244300; 55681824100","Corrigendum to: An evaluation of telehealth expansion in U.S. nursing homes","2021","Journal of the American Medical Informatics Association : JAMIA","0","10.1093/jamia/ocab241","https://www.scopus.com/inward/record.uri?eid=2-s2.0-85123227229&doi=10.1093%2fjamia%2focab241&partnerID=40&md5=1fe233ccb6a30174530c2ca829f80ca2","[No abstract available]","erratum","NLM (Medline)","Erratum","Final","Scopus","2-s2.0-85123227229"
"Rogers J.R.; Lee J.; Zhou Z.; Cheung Y.K.; Hripcsak G.; Weng C.","Rogers, James R. (56544974500); Lee, Junghwan (57211503526); Zhou, Ziheng (57221812003); Cheung, Ying Kuen (57217105422); Hripcsak, George (7004471151); Weng, Chunhua (54887805800)","56544974500; 57211503526; 57221812003; 57217105422; 7004471151; 54887805800","Contemporary use of real-world data for clinical trial conduct in the United States: a scoping review","2021","Journal of the American Medical Informatics Association : JAMIA","15","10.1093/jamia/ocaa224","https://www.scopus.com/inward/record.uri?eid=2-s2.0-85100280320&doi=10.1093%2fjamia%2focaa224&partnerID=40&md5=9720682a2aae2df641e91f36fe698d44","OBJECTIVE: Real-world data (RWD), defined as routinely collected healthcare data, can be a potential catalyst for addressing challenges faced in clinical trials. We performed a scoping review of database-specific RWD applications within clinical trial contexts, synthesizing prominent uses and themes. MATERIALS AND METHODS: Querying 3 biomedical literature databases, research articles using electronic health records, administrative claims databases, or clinical registries either within a clinical trial or in tandem with methodology related to clinical trials were included. Articles were required to use at least 1 US RWD source. All abstract screening, full-text screening, and data extraction was performed by 1 reviewer. Two reviewers independently verified all decisions. RESULTS: Of 2020 screened articles, 89 qualified: 59 articles used electronic health records, 29 used administrative claims, and 26 used registries. Our synthesis was driven by the general life cycle of a clinical trial, culminating into 3 major themes: trial process tasks (51 articles); dissemination strategies (6); and generalizability assessments (34). Despite a diverse set of diseases studied, <10% of trials using RWD for trial process tasks evaluated medications or procedures (5/51). All articles highlighted data-related challenges, such as missing values. DISCUSSION: Database-specific RWD have been occasionally leveraged for various clinical trial tasks. We observed underuse of RWD within conducted medication or procedure trials, though it is subject to the confounder of implicit report of RWD use. CONCLUSION: Enhanced incorporation of RWD should be further explored for medication or procedure trials, including better understanding of how to handle related data quality issues to facilitate RWD use. © The Author(s) 2020. Published by Oxford University Press on behalf of the American Medical Informatics Association. All rights reserved. For permissions, please email: journals.permissions@oup.com.","Clinical Trials as Topic; Databases as Topic; Electronic Health Records; Humans; Registries; Research Design; United States; clinical trial (topic); data base; electronic health record; human; methodology; procedures; register; United States","NLM (Medline)","Review","Final","Scopus","2-s2.0-85100280320"
